{
  "schema_version": "0.1.0",
  "source_ref": "/home/lyric/growth-engine-pipeline/content/runs/20260319_official_x_recheck_v3/03_source_items/official_x/items/x-openai-af7edec328da/source_item.json",
  "routing_mode": "llm_router_plus_reviewer",
  "prefilter": {
    "candidate_framework_ids": [
      "02_launch_application"
    ],
    "why_these_candidates": [
      "02_launch_application: score=5 because task_hint=release, signal_hit=introducing, release_signals=introducing"
    ]
  },
  "router_decision": {
    "agent_name": "router",
    "model": "codex-default",
    "evaluated_at": "2026-03-19T10:45:18Z",
    "top_choice": {
      "framework_id": "02_launch_application",
      "submode_id": "release_showcase",
      "confidence": "medium",
      "rationale": "The source is a release-style post pointing readers to a specific public resource page and video. The payoff appears to be driving clicks, curiosity, and trial of a newly introduced challenge/resource, not explaining feature boundaries or walking through an old-to-new migration path. That matches a resource/showcase release better than an adoption playbook.",
      "triggered_routing_signals": [
        "Explicit release cue via \"introducing\"",
        "Direct link to a named resource page",
        "Post functions as announcement plus entry point",
        "Value is framed as try/visit, not detailed how-to"
      ],
      "supporting_source_quotes": [
        "\"Are you up for a challenge?\"",
        "\"openai.com/parameter-golf\"",
        "\"Video\"",
        "\"introducing\""
      ],
      "matched_sample_ids": [
        "2033848539332415986"
      ],
      "ambiguity_notes": [
        "The excerpt is thin, so submode confidence is limited by lack of page detail.",
        "If the linked page contains substantial usage guidance, feature_playbook could become stronger."
      ]
    },
    "alternative_choices": [
      {
        "framework_id": "02_launch_application",
        "submode_id": "feature_playbook",
        "confidence": "low",
        "rationale": "Possible if the linked page mainly clarifies how the challenge or capability works and when to use it, but the visible post itself does not show that depth.",
        "triggered_routing_signals": [
          "Named release object",
          "Possible explanatory linked context"
        ],
        "supporting_source_quotes": [
          "\"OpenAI Model Craft: Parameter Golf\"",
          "\"introducing\""
        ],
        "matched_sample_ids": [
          "2033651724603240688"
        ],
        "ambiguity_notes": [
          "The post text lacks concrete best practices, boundaries, or setup guidance."
        ]
      },
      {
        "framework_id": "02_launch_application",
        "submode_id": "pain_to_adoption",
        "confidence": "low",
        "rationale": "Only viable if the linked material strongly contrasts parameter golf against a worse prior workflow, which is not evident in the provided source text.",
        "triggered_routing_signals": [
          "Release context"
        ],
        "supporting_source_quotes": [
          "\"parameter-golf\"",
          "\"introducing\""
        ],
        "matched_sample_ids": [
          "2032283258650759362"
        ],
        "ambiguity_notes": [
          "No explicit old-vs-new pain framing appears in the source excerpt."
        ]
      }
    ]
  },
  "reviewer_decision": {
    "agent_name": "reviewer",
    "model": "codex-default",
    "evaluated_at": "2026-03-19T10:45:32Z",
    "agrees_with_router": true,
    "override_choice": null,
    "concerns": [
      "The release cue \"introducing\" appears to come from linked context rather than the X post itself, so the evidence is somewhat thinner than the rationale suggests.",
      "Source evidence is sparse; the choice depends on treating the linked page as the primary payoff surface rather than the post text alone."
    ],
    "requires_human_review": false
  },
  "final_decision": {
    "framework_id": "02_launch_application",
    "submode_id": "release_showcase",
    "confidence": "medium",
    "rationale": "The source is a release-style post pointing readers to a specific public resource page and video. The payoff appears to be driving clicks, curiosity, and trial of a newly introduced challenge/resource, not explaining feature boundaries or walking through an old-to-new migration path. That matches a resource/showcase release better than an adoption playbook.",
    "matched_sample_ids": [
      "2033848539332415986"
    ],
    "requires_human_review": false
  }
}
