{
  "schema_version": "0.1.0",
  "source_ref": "/home/lyric/growth-engine-pipeline/content/runs/20260319_000000__official_x__original_only/03_source_items/official_x/items/x-openai-af7edec328da/source_item.json",
  "routing_mode": "llm_router_plus_reviewer",
  "prefilter": {
    "candidate_framework_ids": [
      "01_money_proof",
      "06_checklist_template"
    ],
    "why_these_candidates": [
      "01_money_proof: score=5 because signal_hit=$, business_metric_signals=3",
      "06_checklist_template: score=5 because signal_hit=tutorial, body_hit=how to, execution_path_hint, sectioned_source"
    ]
  },
  "router_decision": {
    "agent_name": "router",
    "model": "codex-default",
    "evaluated_at": "2026-03-19T06:14:10Z",
    "top_choice": {
      "framework_id": "06_checklist_template",
      "submode_id": "guided_onboarding",
      "confidence": "low",
      "rationale": "Among the provided frameworks, this source is closest to an action-oriented onboarding entry point: a challenge CTA plus a link likely containing participation steps. It does not show the proof chain, timeline, or postmortem structure required by money-proof frameworks.",
      "triggered_routing_signals": [
        "task_hints includes tutorial",
        "Direct CTA with external participation link",
        "Source includes linked_context section",
        "No quantified result-replay narrative or system postmortem"
      ],
      "supporting_source_quotes": [
        "Are you up for a challenge? http://openai.com/parameter-golf",
        "Are you up for a challenge? openai.com/parameter-golf Video",
        "task_hints: tutorial",
        "sections: x_post, linked_context"
      ],
      "matched_sample_ids": [
        "2029894874888278198",
        "2031396119104856437"
      ],
      "ambiguity_notes": [
        "The in-thread text is extremely short and promotional.",
        "Most executable detail appears to be off-thread in the linked page.",
        "Could also be interpreted as a release teaser, which weakens checklist fit."
      ]
    },
    "alternative_choices": [
      {
        "framework_id": "01_money_proof",
        "submode_id": "metric_postmortem",
        "confidence": "low",
        "rationale": "Dollar signals are present, but they look like challenge prize amounts rather than audited operating results. The source lacks process breakdown, bottlenecks, and lessons-learned structure.",
        "triggered_routing_signals": [
          "metric_signals include dollar amounts",
          "Prefilter flagged money_proof from '$' hit",
          "No operator-style retrospective evidence"
        ],
        "supporting_source_quotes": [
          "fact_anchors: \"$25\", \"$500\", \"$1000\"",
          "metric_signals: \"$25\", \"$500\", \"$1000\"",
          "Are you up for a challenge?"
        ],
        "matched_sample_ids": [
          "2031489944083116370"
        ],
        "ambiguity_notes": [
          "Prize incentives can mimic metric signals without being outcome proof.",
          "No timeline or causal system evidence is visible in the source excerpt."
        ]
      }
    ]
  },
  "reviewer_decision": {
    "agent_name": "reviewer",
    "model": "codex-default",
    "evaluated_at": "2026-03-19T06:14:32Z",
    "agrees_with_router": true,
    "override_choice": null,
    "concerns": [
      "In-thread evidence is very thin and does not explicitly contain step-by-step onboarding content; checklist fit is inferred from the linked page.",
      "The post can also be read as a launch/challenge teaser, so submode confidence is inherently limited.",
      "Dollar signals look like prize incentives rather than audited outcomes, so money_proof remains a weak fit."
    ],
    "requires_human_review": true
  },
  "final_decision": {
    "framework_id": "06_checklist_template",
    "submode_id": "guided_onboarding",
    "confidence": "low",
    "rationale": "Among the provided frameworks, this source is closest to an action-oriented onboarding entry point: a challenge CTA plus a link likely containing participation steps. It does not show the proof chain, timeline, or postmortem structure required by money-proof frameworks.",
    "matched_sample_ids": [
      "2029894874888278198",
      "2031396119104856437"
    ],
    "requires_human_review": true
  }
}
