{
  "schema_version": "0.1.0",
  "source_ref": "/home/lyric/growth-engine-pipeline/content/runs/20260319_official_x_recheck_v2/03_source_items/official_x/items/x-openai-8f6ed0f162e6/source_item.json",
  "routing_mode": "llm_router_plus_reviewer",
  "prefilter": {
    "candidate_framework_ids": [
      "01_money_proof",
      "02_launch_application",
      "03_opinion_decode"
    ],
    "why_these_candidates": [
      "01_money_proof: score=7 because body_hit=customers, signal_hit=%, body_hit=pricing, business_metric_signals=20",
      "02_launch_application: score=7 because task_hint=release, title_hit=introducing, release_signals=release,introducing,available today",
      "03_opinion_decode: score=2 because body_hit=future, body_hit=think"
    ]
  },
  "router_decision": {
    "agent_name": "router",
    "model": "codex-default",
    "evaluated_at": "2026-03-19T10:41:30Z",
    "top_choice": {
      "framework_id": "02_launch_application",
      "submode_id": "release_showcase",
      "confidence": "high",
      "rationale": "The source is a clear release announcement for a newly available model, with immediate value framing and a direct resource link. It fits launch-triggered adoption/showcase content better than money-proof or opinion-decode because the core payload is what launched, where it is available, and why it is worth trying now.",
      "triggered_routing_signals": [
        "Explicit release language: \"available today\" and \"introducing\"",
        "New model/capability launch across ChatGPT, Codex, and API",
        "Value framed in quick benefits: coding, multimodal, subagents, 2x faster",
        "Includes direct entry link to the launch page"
      ],
      "supporting_source_quotes": [
        "\"available today in ChatGPT, Codex, and the API\"",
        "\"Optimized for coding\"",
        "\"2x faster than GPT-5 mini\"",
        "\"introducing-gpt-5-4-mini-and-nano\""
      ],
      "matched_sample_ids": [
        "2033848539332415986"
      ],
      "ambiguity_notes": [
        "The post is short and promotional, so it is close to pure announcement/news.",
        "It does not provide enough usage detail for feature_playbook.",
        "It lacks interpretation depth for signal_decode."
      ]
    },
    "alternative_choices": [
      {
        "framework_id": "02_launch_application",
        "submode_id": "feature_playbook",
        "confidence": "medium",
        "rationale": "A plausible alternative because the source announces a new model capability set, but the post itself does not explain usage boundaries or how to adopt the feature in practice.",
        "triggered_routing_signals": [
          "New capability launch",
          "Problem-solution hints via optimization claims"
        ],
        "supporting_source_quotes": [
          "\"Optimized for coding\"",
          "\"multimodal understanding, and subagents\""
        ],
        "matched_sample_ids": [
          "2033651724603240688"
        ],
        "ambiguity_notes": [
          "Missing quickstart, best practices, or when-not-to-use guidance."
        ]
      },
      {
        "framework_id": "03_opinion_decode",
        "submode_id": "signal_decode",
        "confidence": "low",
        "rationale": "This could be treated as an industry signal because it is a notable model release, but the source itself is mostly official launch copy rather than decoded interpretation.",
        "triggered_routing_signals": [
          "Notable external model release",
          "Performance comparison included"
        ],
        "supporting_source_quotes": [
          "\"2x faster than GPT-5 mini\"",
          "\"available today\""
        ],
        "matched_sample_ids": [
          "2033806716492538155"
        ],
        "ambiguity_notes": [
          "No real authorial decoding, comparison framework, or risk/importance analysis is present."
        ]
      }
    ]
  },
  "reviewer_decision": {
    "agent_name": "reviewer",
    "model": "codex-default",
    "evaluated_at": "2026-03-19T10:41:47Z",
    "agrees_with_router": true,
    "override_choice": null,
    "concerns": [
      "The source is borderline for `02_launch_application` because it is very short and reads like an official announcement, which the framework warns can collapse into `纯新闻转述`.",
      "`release_showcase` is defensible only because there is a direct resource link plus compact value framing (`optimized for...`, `2x faster`), but the adoption/playbook depth is weak.",
      "No evidence supports `01_money_proof`, and `03_opinion_decode` would overstate the amount of interpretation present in the source."
    ],
    "requires_human_review": false
  },
  "final_decision": {
    "framework_id": "02_launch_application",
    "submode_id": "release_showcase",
    "confidence": "high",
    "rationale": "The source is a clear release announcement for a newly available model, with immediate value framing and a direct resource link. It fits launch-triggered adoption/showcase content better than money-proof or opinion-decode because the core payload is what launched, where it is available, and why it is worth trying now.",
    "matched_sample_ids": [
      "2033848539332415986"
    ],
    "requires_human_review": false
  }
}
